CPUID 00000000: 00000017-756E6547-6C65746E-49656E69 [GenuineIntel]
CPUID 00000001: 0007065A-02200800-03D8E20B-1F8BFBFF
CPUID 00000002: 61B4A001-0000FFC0-00000000-00000000
CPUID 00000003: 00000000-00000000-00000000-00000000
CPUID 00000004: 3C000121-00C0003F-0000003F-00000001 [SL 00]
CPUID 00000004: 3C000122-01C0003F-0000003F-00000001 [SL 01]
CPUID 00000004: 3C01C143-03C0003F-000003FF-00000001 [SL 02]
CPUID 00000005: 00000040-00000040-00000003-03000020
CPUID 00000006: 00000004-00000000-00000000-00000000
CPUID 00000007: 00000000-00002282-00000000-00000000 [SL 00]
CPUID 00000008: 00000000-00000000-00000000-00000000
CPUID 00000009: 00000000-00000000-00000000-00000000
CPUID 0000000A: 07280203-00000000-00000000-00000503
CPUID 0000000B: 00000001-00000001-00000100-00000002 [SL 00]
CPUID 0000000B: 00000005-00000008-00000201-00000002 [SL 01]
CPUID 0000000C: 00000000-00000000-00000000-00000000
CPUID 0000000D: 00000000-00000000-00000000-00000000
CPUID 0000000E: 00000000-00000000-00000000-00000000
CPUID 0000000F: 00000000-00000000-00000000-00000000
CPUID 00000010: 00000000-00000000-00000000-00000000
CPUID 00000011: 00000000-00000000-00000000-00000000
CPUID 00000013: 00000000-00000000-00000000-00000000
CPUID 00000014: 00000000-00000000-00000000-00000000 [SL 00]
CPUID 00000015: 00000004-00000120-018CBA80-00000000
CPUID 00000016: 00000000-00000000-00000000-00000000
CPUID 00000017: 00000003-00000001-00000001-00000001 [SL 00]
CPUID 00000017: 756E6547-20656E69-65727053-72746461 [SL 01]
CPUID 00000017: 52286D75-72502029-7365636F-20726F73 [SL 02]
CPUID 00000017: 20202020-20202020-20202020-00202020 [SL 03]
CPUID 80000000: 80000008-00000000-00000000-00000000
CPUID 80000001: 00000000-00000000-00000101-28100000
CPUID 80000002: 20202020-20202020-65727053-72746461 [        Spreadtr]
CPUID 80000003: 53206D75-35383943-492D4933-20202041 [um SC9853I-IA   ]
CPUID 80000004: 00000000-00000000-00383237-007A484D []
CPUID 80000005: 00000000-00000000-00000000-00000000
CPUID 80000006: 00000000-00000000-04008040-00000000
CPUID 80000007: 00000000-00000000-00000000-00000100
CPUID 80000008: 00003024-00000000-00000000-00000000
