CPUID 00000000: 0000000B-756E6547-6C65746E-49656E69 [GenuineIntel]
CPUID 00000001: 000506A0-00100800-43D8E3BF-BFEBFBFF
CPUID 00000002: 61B3A001-0000FFC2-00000000-00000000
CPUID 00000003: 00000000-00000000-00000000-00000000
CPUID 00000004: 1C000121-0140003F-0000003F-00000001 [SL 00]
CPUID 00000004: 1C000122-01C0003F-0000003F-00000001 [SL 01]
CPUID 00000004: 1C00C143-03C0003F-000003FF-00000001 [SL 02]
CPUID 00000005: 00000040-00000040-00000003-33000020
CPUID 00000006: 00000007-00000002-00000009-00000000
CPUID 00000007: 00000000-00002282-00000000-00000000 [SL 00]
CPUID 00000008: 00000000-00000000-00000000-00000000
CPUID 00000009: 00000000-00000000-00000000-00000000
CPUID 0000000A: 07280203-00000000-00000000-00004503
CPUID 0000000B: 00000001-00000001-00000100-00000000 [SL 00]
CPUID 0000000B: 00000004-00000004-00000201-00000000 [SL 01]
CPUID 80000000: 80000008-00000000-00000000-00000000
CPUID 80000001: 00000000-00000000-00000101-28100000
CPUID 80000002: 20202020-20202020-65746E49-2952286C [        Intel(R)]
CPUID 80000003: 6F744120-4D54286D-50432029-5A202055 [ Atom(TM) CPU  Z]
CPUID 80000004: 30383533-20402020-33332E31-007A4847 [3580  @ 1.33GHz]
CPUID 80000005: 00000000-00000000-00000000-00000000
CPUID 80000006: 00000000-00000000-04008040-00000000
CPUID 80000007: 00000000-00000000-00000000-00000100
CPUID 80000008: 00003024-00000000-00000000-00000000
